url_id,url,date,title,summary,extraction_date,author
8dba4a194eeef7f51fa395fc29646b90,https://www.afr.com/markets/equity-markets/positive-sentiment-flows-from-us-economic-growth-data-20170831-gy7mh3,2017/08/31,Positive sentiment flows from US economic growth data,Local shares are poised to edge higher as Wall Street advanced on signs the US economic expansion is gathering momentum.,19-04-2021,Timothy Moore
b5e8f05df1e659ac8bc9acf7bafce7c9,https://www.afr.com/markets/equity-markets/australian-shares-to-rise-n-korea-tensions-ease-20170830-gy6tmr,2017/08/30,"Australian shares to rise, N Korea tensions ease",Local shares are poised to rise amid a focus on both economic data and earnings. Base metals higher. $A flat.,19-04-2021,Timothy Moore
1162bb0a5bd973eaf6dba2ab4e943cea,https://www.afr.com/markets/equity-markets/flat-open-as-harvey-soaks-sentiment-on-wall-street-20170829-gy61sw,2017/08/29,ASX poised to edge higher as Harvey soaks sentiment on Wall Street,"Australian shares are poised to edge higher, following New York, as Hurricane Harvey hammered the price of oil.",19-04-2021,Timothy Moore
b7d3b31f5122417f62f7e8e3e427012f,https://www.afr.com/markets/equity-markets/asx-set-for-slight-rise-after-wall-st-investors-seek-tax-reform-20170826-gy4odk,2017/08/28,ASX set for slight rise after Wall St investors seek tax reform,"Australian stocks are poised to open higher, helped by a modestly positive session on Wall Street. ASX futures up 6 points.",19-04-2021,Timothy Moore
b4c2d13135c731be257c3fe8206c657e,https://www.afr.com/markets/equity-markets/equities-pause-ahead-of-janet-yellen-20170825-gy3rvr,2017/08/25,Equities pause ahead of Janet Yellen,Global investors are fixed to the sidelines as they await a speech by Janet Yellen. ASX futures flat. $A little changed.,19-04-2021,Timothy Moore
9003ad6729521915e8ef7c7cd8717c9d,https://www.afr.com/markets/equity-markets/riskoff-sentiment-depresses-wall-st-20170824-gy2tgc,2017/08/24,Risk-off sentiment depresses Wall St,"ASX futures are pointing to a positive open, even as all three major US benchmarks slide lower. $A flat.",19-04-2021,Timothy Moore
aaf43093c1ffbfa0ecfcac378a736346,https://www.afr.com/markets/equity-markets/miners-techs-pace-global-stocks-higher-20170823-gy1yzk,2017/08/23,"Miners, techs pace global stocks higher","Optimism about the outlook for miners, including BHP and Rio, has helped paced markets higher. ASX futures up 32pts.",19-04-2021,Timothy Moore
da47afdac668cbbc98b00267739ca29c,https://www.afr.com/markets/equity-markets/equities-pause-even-as-metals-shine-20170822-gy16zq,2017/08/22,Equities pause even as metals shine,"Global equities paused overnight, even as base metals extended their recent advances. Iron ore nears $US80 a tonne.",19-04-2021,Timothy Moore
0c30bbd372438f78dc50e85caf7de678,https://www.afr.com/markets/equity-markets/asx-to-open-flat-while-sp-500-resiliency-is-tested-even-as-iron-ore-oil-surge-20170819-gxzspc,2017/08/21,"ASX to open flat while S&P 500 resiliency is tested even as iron ore, oil surge ","Australian shares are set to open flat, even after iron ore and oil leapt higher over the weekend. Wall St slipped. $A advanced.",19-04-2021,Timothy Moore
4eba9f5985e07309a78e9bcde9454cb6,https://www.afr.com/markets/equity-markets/asx-poised-to-fall-as-risk-aversion-rises-20170818-gxyvp2,2017/08/18,ASX poised to fall as risk aversion rises,"ASX shares are poised to drop at the open, following Wall Street which was roiled by concerns about political chaos in the US.",19-04-2021,Timothy Moore
16dc1be05e1e468bb99bc322a8b77b8d,https://www.afr.com/markets/equity-markets/miners-poised-to-lead-asx-higher-20170817-gxxx3m,2017/08/17,Miners poised to lead ASX higher,A surge in base metal prices is poised to propel the ASX higher at the open. BHP was up 2.8% in New York. $A surges 1.4%.,19-04-2021,Timothy Moore
6c01b6bb80076df7483c205f9562f65f,https://www.afr.com/markets/equity-markets/asx-futures-dip-ahead-of-reporting-wave-20170816-gxx0ny,2017/08/16,ASX futures dip ahead of reporting wave,A wave of earnings statements will set the tone for the open after a mixed session on Wall Street. $A extends slide.,19-04-2021,Timothy Moore
90c02daccecb98e6ad99d1db9d792918,https://www.afr.com/markets/equity-markets/global-investors-refocus-on-earnings-as-us-v-north-korea-rhetoric-eases-20170815-gxw6n6,2017/08/15,"Global investors refocus on earnings, as US v North Korea rhetoric eases",Overseas shares rallied overnight as investors bet on improved prospects for corporate profits. ASX futures +23pts.,19-04-2021,Timothy Moore
3f7157df89fdd7b0fe93c91d64678818,https://www.afr.com/markets/equity-markets/asx-set-to-open-flat-as-low-us-inflation-eases-north-korean-angst-20170812-gxuqnw,2017/08/14,ASX set to open flat as low US inflation eases North Korean angst,Wall Street edged higher as the latest inflation print lessened the case for a third US rate hike this year. ASX futures are flat.,19-04-2021,Timothy Moore
143e1238c4561755248c707629705118,https://www.afr.com/markets/equity-markets/asx-poised-to-join-global-retreat-20170811-gxtwdp,2017/08/11,ASX poised to join global retreat,Global markets retreated at a faster pace overnight and the ASX is poised to drop at the open. ASX futures down 68 points.,19-04-2021,Timothy Moore
f0d013711b9d32497b8038b7dc321c3f,https://www.afr.com/markets/equity-markets/asx-futures-dip-ahead-of-earnings-from-agl-amp-mfg-and-ora-20170810-gxsyb6,2017/08/10,"ASX futures up ahead of earnings from AGL, AMP, MFG and ORA","Concern about rising tensions between the US and North Korea put investors on the defensive overnight. AGL, AMP report today.",19-04-2021,Timothy Moore
e9ce76b0438c1a13110ead3a2879d4a6,https://www.afr.com/markets/equity-markets/asx-futures-higher-a-flat-20170809-gxs55k,2017/08/09,"ASX futures pare gains, Wall St sinks as Trump shatters calm",Futures pulled back after President Donald Trump escalated the war of words with North Korea. CBA reports blockbuster profit.,19-04-2021,Timothy Moore
e2f63883d15cb9f77dc907f591fcb9d3,https://www.afr.com/markets/equity-markets/asx-poised-to-edge-higher-20170808-gxrbfr,2017/08/08,ASX poised to edge higher,Local shares are set to edge higher with the Dow on track to close at a record high for the ninth straight day.,19-04-2021,Timothy Moore
54993948b98f3f2f5c3c73a7e351633b,https://www.afr.com/markets/equity-markets/asx-to-open-higher-after-dow-extends-winning-streak-20170805-gxpx9g,2017/08/07,ASX to open higher after Dow extends winning streak,The Dow lifted for an eighth consecutive day as the latest US jobs data backed the Federal Reserve's bias to tighter policy.,19-04-2021,Timothy Moore
197c1d2899daf52c66c5b8e85dd09cc0,https://www.afr.com/markets/equity-markets/flat-local-open-ahead-of-rba-economic-forecasts-20170804-gxp17s,2017/08/04,Flat local open ahead of RBA economic forecasts,Local shares are poised to open little changed as earnings season edges towards its peak amid high expectations. $A slips.,19-04-2021,Timothy Moore
4d8c614727c3fd1d4d45c2ace5440a9c,https://www.afr.com/markets/equity-markets/asx-poised-for-flat-open-on-rio-wall-st-pause-20170803-gxo6c4,2017/08/03,"ASX advance could be checked by Rio, Wall St edges higher",Local shares could be checked in the wake of Rio Tinto's results and profit-taking on Wall Street.,19-04-2021,Timothy Moore
3fb71a99cca746f2dc972345ee66ff28,https://www.afr.com/markets/equity-markets/asx-poised-to-drift-lower-as-commodities-retreat-20170802-gxnfv4,2017/08/02,ASX poised to drift lower as commodities retreat,"Iron ore, oil and base metals drifted lower overnight setting the stage for a modestly lower local open. $A down 0.5%.",19-04-2021,Timothy Moore
e98893f401514549ec50db071fd4c31b,https://www.afr.com/markets/equity-markets/bhp-rio-poised-to-lift-asx-ahead-of-rba-rate-call-20170801-gxmn3n,2017/08/01,"BHP, Rio poised to lift ASX ahead of RBA rate call","While ASX futures are pointing to a flat open, the US listed shares of BHP and Rio are higher on gains in iron ore and oil.",19-04-2021,Timothy Moore
